<?xml version="1.0" encoding="UTF-8"?>
<schema xmlns="http://www.w3.org/2001/XMLSchema"
	targetNamespace="http://www.example.org/BanqueService"
	xmlns:tns="http://www.example.org/BanqueService"
	elementFormDefault="qualified">

	<element name="BanqueService">
		<complexType>
			<sequence>
				<element name="conversion" type="conversion"></element>
				<element name="getComptes" type="compte" minOccurs="1"
					maxOccurs="unbounded">

				</element>
				<element name="getCompte" type="compte">

				</element>
			</sequence>
		</complexType>
	</element>

	<complexType name="conversion">
		<sequence>
			<element name="montant" type="double">
			</element>
		</sequence>
	</complexType>


	<complexType name="compte">
		<sequence>
			<element name="solde" type="double"></element>
			<element name="code" type="integer"></element>
			<element name="dataCreation" type="date"></element>

		</sequence>
	</complexType>

</schema>
